[
    {
        "venue": "PPG Paints Arena",
        "home team name": "PIT",
        "home team percentage chance of winning": "40%",
        "predicted home team goals": "2.8",
        "away team name": "FLA",
        "away team percentage chance of winning": "60%",
        "predicted away team goals": "3.4",
        "confidence rating": "medium",
        "simulation results": "FLA 7 wins - PIT 3 wins",
        "explanation": "Most of the statistics favor the away team(A), even though the game is at home for the Pittsburgh Penguins (PIT). The game will be played at the PPG Paints Arena and the Penguins have had a good home record with 13 wins compared to 8 losses. However, the Florida Panthers (FLA) have posted a superior performance over the Penguins this season with an impressive 33 wins, 15 losses and 4 overtime losses (compared with PIT's 23-19-7). FLA has a clear edge in recent form too, with 6 wins in their last 10 games, compared to 3 by PIT. The goal differential also favors FLA, as they've netted 12 more goals than PIT in the last 10 games and have a better season-long goal differential of +36 compared to PIT's +13. Notably, FLA's streak is a winning one ('W'), compared to PIT's losing ('L') one, and FLA has a superior road record, having won 10 more game on the road than PIT has won at home. Given these facts, I give FLA a 60% chance of winning and the PIT a 40% chance. Since I predict FLA to win, they naturally should have more goals; I predict they will score 3.4 compared to PIT's 2.8, as FLA has been scoring an average of 3.5 goals/game in their last 10 compared to PIT's 2.3. In summary, while I acknowledge the power of home advantage and respect PIT equally, I give FLA the edge in this matchup, based on their recent form, season-long performance, goal differential and road record. Although my confidence level is not at its highest, I believe the numbers speak for themselves."
    },
    {
        "venue": "Canada Life Centre",
        "home team name": "WPG",
        "home team percentage chance of winning": "78%",
        "predicted home team goals": "3.0",
        "away team name": "SJS",
        "away team percentage chance of winning": "22%",
        "predicted away team goals": "1.9",
        "confidence rating": "high",
        "simulation results": "WPG 8 wins - SJS 2 wins",
        "explanation": "Based on the current performance and statistics, the Winnipeg Jets (WPG) have a strong advantage over the San Jose Sharks (SJS). The Jets have a superior winning record for this season with 31 wins out of 50 games, compared to the Sharks' 14 wins out of 51 games. They've scored more goals in total compared to SJS (151 vs 107) and have conceded less (117 vs 199). Their goal differential percentage also speaks to this point (.68 compared to -1.80). Despite a less impressive performance in the last 10 games, WPG has still outperformed SJS in goal difference. Furthermore, the Jets have a much better home record than the Sharks have a road record. The Jets have won 17 out of 24 games at home, while the Sharks have only 5 wins to 19 losses away. Considering all of these factors, I predict WPG has a 78% chance of winning this game. Based on the average goals per game in recent matches, WPG should score around 3 goals, while SJS may fall short with around 1.9 goals. Given all these statistics, the prediction confidence rating is 'high'. As a result of simulated matches, WPG wins in 8 out of 10 scenarios, showing a strong possibility for a Jets' victory."
    },
    {
        "venue": "Mullett Arena",
        "home team name": "ARI",
        "home team percentage chance of winning": "45%",
        "predicted home team goals": "2.8",
        "away team name": "MIN",
        "away team percentage chance of winning": "55%",
        "predicted away team goals": "3.2",
        "confidence rating": "medium",
        "simulation results": "MIN 6 wins - ARI 4 wins",
        "explanation": "The matchup between the Arizona Coyotes (ARI) and the Minnesota Wild (MIN) appears to be pretty even at first glance, with both teams having a similar win-loss record over the season (23-24-4 for ARI vs 24-23-5 for MIN). However, taking a deeper look at the stats, one can see that the Minnesota Wild have somewhat of an edge in this matchup. They have won 7 of their last 10 games compared to ARI's 2 wins in the last 10. Importantly, MIN has been successful in scoring 38 goals against ARI's 26 in their last 10 matches. Additionally, MIN holds a superior away record (11-12) than ARI's home record (15-10). Considering all these statistics, I predict MIN has a 55% chance of winning the game, and ARI has a 45% chance. The predicted goals for MIN stand at 3.2 based on their recent form while ARI is expected to score approximately 2.8. Thus, the confidence rating can be considered 'medium'. The simulated match-ups resulted in 6 wins for MIN against ARI's 4 wins, which reinforces the predicted edge for MIN. Despite ARI's home advantage, MIN's form, goal-scoring capability, and comparable away record make them the slightly preferred team."
    }
]